{
  "schema_version": "v1",
  "bundle_id": "contaminant-monitoring-bundle-45467bd7a63b",
  "bundleProfile": "internal_review",
  "contaminantFamily": "mercury_food_contaminants",
  "jurisdiction": "eu",
  "authority": null,
  "datasetId": "efsa.comprehensive_food_consumption_db.mercury_support",
  "checkStatus": "pass",
  "overallSubmissionUse": "allowed",
  "submissionCandidateAllowed": true,
  "checkResult": {
    "checkStatus": "pass",
    "contaminantFamily": "mercury_food_contaminants",
    "jurisdiction": "eu",
    "authority": null,
    "datasetId": "efsa.comprehensive_food_consumption_db.mercury_support",
    "overallSubmissionUse": "allowed",
    "submissionCandidateAllowed": true,
    "occurrenceEvidenceRecords": [
      {
        "recordId": "eu.mercury.occurrence_evidence.official_monitoring_context",
        "displayName": "Mercury official monitoring evidence context",
        "authority": "EFSA",
        "jurisdiction": "eu",
        "contaminantFamily": "mercury_food_contaminants",
        "evidenceKind": "official_monitoring_context",
        "analytes": [
          "methylmercury",
          "inorganic_mercury",
          "total_mercury"
        ],
        "matrixGroups": [
          "fish_and_seafood",
          "large_predatory_fish",
          "broad_food_supply"
        ],
        "sampleSetSummary": "EFSA mercury occurrence and dietary context linked to EU official-control and contaminants-law review.",
        "measuredUnit": "mg/kg",
        "dataPeriod": "2012-2026_review_context",
        "lowerBoundHandling": "review_occurrence_lower_bound_context",
        "maturityStatus": "established",
        "evidenceSupportStatus": "established",
        "submissionUse": "allowed",
        "documentStatus": "final_current",
        "sourceIds": [
          "efsa.mercury.food.2012",
          "efsa.mercury.fish_consumption.2026",
          "efsa.metals.topic.2026",
          "eu.reg.2023_915",
          "eu.reg.333_2007"
        ],
        "occurrenceRecordIds": [
          "efsa.mercury.occurrence_monitoring.support"
        ],
        "datasetIds": [
          "efsa.comprehensive_food_consumption_db.mercury_support"
        ],
        "methodEvidenceRecordIds": [
          "eu.mercury.analytical_method_evidence.official_control"
        ],
        "legalAuthorityIds": [
          "eu.mercury.contaminants.reg_2023_915",
          "eu.mercury.official_control.reg_333_2007"
        ],
        "referenceValueRecordIds": [
          "efsa.methylmercury.twi.2012",
          "efsa.inorganic_mercury.twi.2012"
        ],
        "linkedReviewFocusIds": [
          "efsa.mercury.large_predatory_fish.review_focus",
          "efsa.mercury.sensitive_population_advice.review_focus"
        ],
        "reportingProfileIds": [],
        "notes": [
          "Captures governed occurrence context for mercury food review and monitoring interpretation.",
          "Exposed for evidence linkage and auditability, not as a native mercury exposure engine."
        ]
      }
    ],
    "analyticalMethodEvidenceRecords": [
      {
        "recordId": "eu.mercury.analytical_method_evidence.official_control",
        "displayName": "Mercury official-control analytical method evidence",
        "authority": "European Union",
        "jurisdiction": "eu",
        "contaminantFamily": "mercury_food_contaminants",
        "evidenceKind": "official_control_sampling_and_analysis",
        "analytes": [
          "methylmercury",
          "inorganic_mercury",
          "total_mercury"
        ],
        "matrixGroups": [
          "fish_and_seafood",
          "large_predatory_fish",
          "broad_food_supply"
        ],
        "techniqueSummary": "Official-control sampling and analysis governance for mercury levels in foodstuffs.",
        "methodCode": null,
        "lodSummary": "Import rows should preserve lod when available for method-review traceability.",
        "lodValue": null,
        "lodUnit": null,
        "loqSummary": "Import rows should preserve loq where reported to support lower-bound and review context.",
        "loqValue": null,
        "loqUnit": null,
        "recoverySummary": "Recovery information should be retained where available to support analytical review context.",
        "recoveryRangePercent": null,
        "measurementUncertaintySummary": "Measurement uncertainty should be retained where available for official-control review context.",
        "measurementUncertaintyPercent": null,
        "storageStabilitySummary": "Storage-stability evidence is external to this pack and should be linked separately when available.",
        "samplingPlanSummary": "Sampling-plan context follows the governed EU official-control regulation and linked EFSA review material.",
        "samplingPlanReference": null,
        "maturityStatus": "established",
        "evidenceSupportStatus": "established",
        "submissionUse": "allowed",
        "documentStatus": "final_current",
        "sourceIds": [
          "eu.reg.333_2007",
          "efsa.mercury.food.2012",
          "eu.reg.2023_915"
        ],
        "methodIds": [
          "eu.mercury.official_control.333_2007",
          "efsa.mercury.food.2012_opinion"
        ],
        "legalAuthorityIds": [
          "eu.mercury.official_control.reg_333_2007",
          "eu.mercury.contaminants.reg_2023_915"
        ],
        "reportingProfileIds": [],
        "notes": [
          "Preserves analytical-method context for mercury review and monitoring import checks.",
          "Dietary MCP does not execute this method; it records its governed review context."
        ]
      }
    ],
    "applicableReportingProfileIds": [],
    "reportingProfileSummary": null,
    "headerResolution": [
      {
        "header": "food",
        "canonicalField": "commodity",
        "recognized": true
      },
      {
        "header": "contaminant",
        "canonicalField": "analyte",
        "recognized": true
      },
      {
        "header": "result",
        "canonicalField": "result_value",
        "recognized": true
      },
      {
        "header": "unit",
        "canonicalField": "unit",
        "recognized": true
      },
      {
        "header": "loq",
        "canonicalField": "loq",
        "recognized": true
      },
      {
        "header": "recovery_percent",
        "canonicalField": "recovery_percent",
        "recognized": true
      },
      {
        "header": "measurement_uncertainty_percent",
        "canonicalField": "measurement_uncertainty_percent",
        "recognized": true
      },
      {
        "header": "sampling_year",
        "canonicalField": "sampling_year",
        "recognized": true
      }
    ],
    "normalizedProjection": {
      "rowCount": 2,
      "analytes": [
        "methylmercury"
      ],
      "commodityNames": [
        "bluefin_tuna",
        "swordfish"
      ],
      "units": [
        "mg/kg"
      ],
      "samplingYears": [
        2025
      ],
      "rowsWithLod": 0,
      "rowsWithLoq": 2,
      "rowsWithRecoveryPercent": 2,
      "rowsWithMeasurementUncertaintyPercent": 2,
      "priorityFoodGroupHits": [
        "fish_and_seafood"
      ],
      "highAttentionFoodHits": [
        "bluefin_tuna",
        "swordfish"
      ],
      "sensitivePopulationGroups": [
        "foetus_and_unborn_child",
        "high_fish_consumers",
        "women_who_are_pregnant_or_planning_pregnancy",
        "young_children"
      ],
      "linkedOccurrenceRecordIds": [
        "efsa.mercury.occurrence_monitoring.support"
      ],
      "linkedReviewFocusIds": [
        "efsa.mercury.large_predatory_fish.review_focus",
        "efsa.mercury.sensitive_population_advice.review_focus"
      ]
    },
    "qualityFlags": [
      {
        "code": "broad_food_supply_fallback",
        "severity": "warning",
        "message": "At least one governed evidence record matched through a `broad_food_supply` fallback rather than a matrix-specific link: ['eu.mercury.analytical_method_evidence.official_control', 'eu.mercury.occurrence_evidence.official_monitoring_context']."
      }
    ],
    "uncertaintyAndAssumptionLedger": [
      {
        "entryId": "row_level_lod_coverage",
        "entryKind": "data_gap",
        "category": "analytical_measurement",
        "severity": "warning",
        "summary": "Row-level LOD coverage is incomplete.",
        "rationale": "0 of 2 rows supplied `lod` values. Detection-limit context should be reviewed against the linked analytical-method evidence rather than assumed from the CSV alone.",
        "conservative": null,
        "affectedFields": [
          "lod"
        ],
        "linkedRecordIds": [
          "eu.mercury.analytical_method_evidence.official_control"
        ],
        "sourceIds": [
          "efsa.mercury.food.2012",
          "eu.reg.2023_915",
          "eu.reg.333_2007"
        ]
      },
      {
        "entryId": "lower_bound_handling.eu.mercury.occurrence_evidence.official_monitoring_context",
        "entryKind": "assumption",
        "category": "occurrence_data",
        "severity": "info",
        "summary": "Lower-bound handling is governed by linked occurrence evidence.",
        "rationale": "review_occurrence_lower_bound_context",
        "conservative": true,
        "affectedFields": [
          "result_value",
          "lod",
          "loq"
        ],
        "linkedRecordIds": [
          "eu.mercury.occurrence_evidence.official_monitoring_context"
        ],
        "sourceIds": [
          "efsa.mercury.food.2012",
          "efsa.mercury.fish_consumption.2026",
          "efsa.metals.topic.2026",
          "eu.reg.2023_915",
          "eu.reg.333_2007"
        ]
      },
      {
        "entryId": "storage_stability.eu.mercury.analytical_method_evidence.official_control",
        "entryKind": "uncertainty",
        "category": "analytical_method",
        "severity": "info",